{"cells":[{"address":"A1","cell_id":"s001!A1","cell_sha256":"697708949ddc1df241c1273402db1fed96a4d6f99f5f9bc98443b08aa8701db5","row_id":"s001!row:1","value_type":"text"},{"address":"B1","cell_id":"s001!B1","cell_sha256":"3622ad51a33cb5115684aa809e54e41bff79b04caf4bb957d4cc88a791369449","row_id":"s001!row:1","value_type":"text"},{"address":"C1","cell_id":"s001!C1","cell_sha256":"5f9a44dc3ecab4559e46fa4fe208e83b189c687ba043e3f44fcdb03ac50bfd12","row_id":"s001!row:1","value_type":"text"},{"address":"A2","cell_id":"s001!A2","cell_sha256":"964f5106b84de89be870cea51ff11749d77184e14f8cffda1ff86fb4b52e81a8","row_id":"s001!row:2","value_type":"text"},{"address":"B2","cell_id":"s001!B2","cell_sha256":"350f96bf28e7866447f54f5c2cf7eec002799c3b478eb41d70ac8191167f6c6d","row_id":"s001!row:2","value_type":"number"},{"address":"C2","cell_id":"s001!C2","cell_sha256":"0acfb6f75aeb5462511070612a0b986ae1eb1d85ab3734ba09bd8d5fc9b036d6","row_id":"s001!row:2","value_type":"date"}],"counts":{"nonblank_cells":6,"rows":2},"rows":[{"cell_ids":["s001!A1","s001!B1","s001!C1"],"row":1,"row_id":"s001!row:1","row_sha256":"a4a24f4aef62fe510e8dd50cac48f2389fd3db978054efdfa8db3d82ee67a095","sheet_id":"s001"},{"cell_ids":["s001!A2","s001!B2","s001!C2"],"row":2,"row_id":"s001!row:2","row_sha256":"bd2b4135b7fa7e73aca7149303bbf89e8d8f57952a9e66493a64d8dad14bdee9","sheet_id":"s001"}],"schema_version":"dcs-candidate-manifest/1.0","source_sha256":"83aca7916497d1bdf53e365ba3a5196c56a485cb843373444645d6cefeec68a9","source_tables_sha256":"f2f002af8be8f08e867fdec7b914c5b19a78a17be6fde6ffdfc130823bf28e19"}
